{
  "id": "pool-look-back-001",
  "slug": "pool-look-back",
  "title": "【画像】プールでめっちゃ見られた女さん、見つめ返してしまうｗｗｗｗｗ",
  "category": "水着",
  "status": "published",
  "published_at": "2026-07-18T12:00:00+09:00",
  "display_date": "2026.07.18",
  "comments": 31,
  "url": "articles/pool-look-back.html",
  "thumbnail": "assets/articles/pool-look-back/image-02.webp",
  "source_url": "https://chaos-giga.com/archives/277872",
  "images_used": 5,
  "summary": "プールで視線を返す投稿を、画像5枚すべて使ったレス形式でまとめる。",
  "tags": [
    "画像",
    "水着",
    "SNS"
  ],
  "featured": true
}